<?xml version="1.0" encoding="UTF-8"?>
<xs:schema xmlns="http://www.uniovi.es" elementFormDefault="qualified"
	targetNamespace="http://www.uniovi.es" xmlns:xs="http://www.w3.org/2001/XMLSchema">
	<xs:element name="circuito">
		<xs:complexType>
			<xs:sequence>
				<xs:element ref="nombre" />
				<xs:element ref="medidas" />
				<xs:element ref="fecha" />
				<xs:element ref="hora" />
				<xs:element ref="vueltas" />
				<xs:element ref="localidad" />
				<xs:element ref="pais" />
				<xs:element ref="patrocinador" />
				<xs:element ref="referencias" />
				<xs:element ref="galeriaFotos" />
				<xs:element ref="galeriaVideos" />
				<xs:element ref="puntoOrigen" />
				<xs:element ref="tramos" />
				<xs:element ref="vencedor" />
				<xs:element ref="mundialClasificacion" />
			</xs:sequence>
		</xs:complexType>
	</xs:element>
	<xs:element name="nombre" type="xs:string" />
	<xs:element name="medidas">
		<xs:complexType>
			<xs:sequence>
				<xs:element ref="longitud" />
				<xs:element ref="anchura" />
			</xs:sequence>
		</xs:complexType>
	</xs:element>
	<xs:element name="longitud">
		<xs:complexType>
			<xs:simpleContent>
				<xs:extension base="xs:positiveInteger">
					<xs:attribute name="unidad" type="xs:string" use="required" />
				</xs:extension>
			</xs:simpleContent>
		</xs:complexType>
	</xs:element>
	<xs:element name="anchura">
		<xs:complexType>
			<xs:simpleContent>
				<xs:extension base="xs:positiveInteger">
					<xs:attribute name="unidad" type="xs:string" use="required" />
				</xs:extension>
			</xs:simpleContent>
		</xs:complexType>
	</xs:element>
	<xs:element name="fecha">
		<xs:complexType>
			<xs:simpleContent>
				<xs:extension base="xs:date">
					<xs:attribute name="anio" type="xs:string" use="required" />
				</xs:extension>
			</xs:simpleContent>
		</xs:complexType>
	</xs:element>
	<xs:element name="hora">
		<xs:complexType>
			<xs:simpleContent>
				<xs:extension base="xs:time">
					<xs:attribute name="zona_horaria" type="xs:string" />
					<xs:attribute name="formato" type="xs:string" />
				</xs:extension>
			</xs:simpleContent>
		</xs:complexType>
	</xs:element>
	<xs:element name="vueltas">
		<xs:complexType>
			<xs:simpleContent>
				<xs:extension base="xs:positiveInteger">
					<xs:attribute name="unidad" type="xs:string" />
				</xs:extension>
			</xs:simpleContent>
		</xs:complexType>
	</xs:element>
	<xs:element name="localidad" type="xs:string" />
	<xs:element name="pais" type="xs:string" />
	<xs:element name="patrocinador" type="xs:string" />
	<xs:element name="referencias">
		<xs:complexType>
			<xs:sequence>
				<xs:element minOccurs="1" maxOccurs="unbounded" ref="referencia" />
			</xs:sequence>
		</xs:complexType>
	</xs:element>
	<xs:element name="referencia">
		<xs:complexType>
			<xs:simpleContent>
				<xs:extension base="xs:string">
					<xs:attribute name="tipo" type="xs:string" />
					<xs:attribute name="enlace" type="xs:string" />
				</xs:extension>
			</xs:simpleContent>
		</xs:complexType>
	</xs:element>
	<xs:element name="galeriaFotos">
		<xs:complexType>
			<xs:sequence>
				<xs:element minOccurs="1" maxOccurs="5" ref="foto" />
			</xs:sequence>
		</xs:complexType>
	</xs:element>
	<xs:element name="foto">
		<xs:complexType>
			<xs:simpleContent>
				<xs:extension base="xs:string">
					<xs:attribute name="archivo" type="xs:string" use="required" />
					<xs:attribute name="descripcion" type="xs:string" />
				</xs:extension>
			</xs:simpleContent>
		</xs:complexType>
	</xs:element>
	<xs:element name="galeriaVideos">
		<xs:complexType>
			<xs:sequence>
				<xs:element minOccurs="1" maxOccurs="3" ref="video" />
			</xs:sequence>
		</xs:complexType>
	</xs:element>
	<xs:element name="video">
		<xs:complexType>
			<xs:simpleContent>
				<xs:extension base="xs:string">
					<xs:attribute name="archivo" type="xs:string" use="required" />
					<xs:attribute name="duracion" type="xs:string" />
					<xs:attribute name="descripcion" type="xs:string" />
				</xs:extension>
			</xs:simpleContent>
		</xs:complexType>
	</xs:element>
	<xs:element name="puntoOrigen">
		<xs:complexType>
			<xs:sequence>
				<xs:element ref="longitudCoord" />
				<xs:element ref="latitudCoord" />
				<xs:element ref="altitudCoord" />
			</xs:sequence>
		</xs:complexType>
	</xs:element>
	<xs:element name="longitudCoord">
		<xs:complexType>
			<xs:simpleContent>
				<xs:extension base="longitudType">
					<xs:attribute name="unidad" type="xs:string" use="required" />
				</xs:extension>
			</xs:simpleContent>
		</xs:complexType>
	</xs:element>

	<xs:element name="latitudCoord">
		<xs:complexType>
			<xs:simpleContent>
				<xs:extension base="latitudType">
					<xs:attribute name="unidad" type="xs:string" use="required" />
				</xs:extension>
			</xs:simpleContent>
		</xs:complexType>
	</xs:element>

	<xs:simpleType name="longitudType">
		<xs:restriction base="xs:decimal">
			<xs:minInclusive value="-180" />
			<xs:maxInclusive value="180" />
		</xs:restriction>
	</xs:simpleType>

	<xs:simpleType name="latitudType">
		<xs:restriction base="xs:decimal">
			<xs:minInclusive value="-90" />
			<xs:maxInclusive value="90" />
		</xs:restriction>
	</xs:simpleType>

	<xs:element name="altitudCoord">
		<xs:complexType>
			<xs:simpleContent>
				<xs:extension base="altitudType">
					<xs:attribute name="unidad" type="xs:string" use="required" />
				</xs:extension>
			</xs:simpleContent>
		</xs:complexType>
	</xs:element>

	<xs:simpleType name="altitudType">
		<xs:restriction base="xs:decimal">
			<xs:minInclusive value="0" />
			<xs:maxInclusive value="8000" />
		</xs:restriction>
	</xs:simpleType>

	<xs:element name="tramos">
		<xs:complexType>
			<xs:sequence>
				<xs:element minOccurs="1" maxOccurs="unbounded" ref="tramo" />
			</xs:sequence>
		</xs:complexType>
	</xs:element>
	<xs:element name="tramo">
		<xs:complexType>
			<xs:sequence>
				<xs:element ref="distancia" />
				<xs:element ref="puntoFinal" />
				<xs:element ref="sector" />
			</xs:sequence>
		</xs:complexType>
	</xs:element>
	<xs:element name="distancia">
		<xs:complexType>
			<xs:simpleContent>
				<xs:extension base="xs:positiveInteger">
					<xs:attribute name="unidad" type="xs:string" use="required" />
				</xs:extension>
			</xs:simpleContent>
		</xs:complexType>
	</xs:element>
	<xs:element name="puntoFinal">
		<xs:complexType>
			<xs:sequence>
				<xs:element ref="longitudCoord" />
				<xs:element ref="latitudCoord" />
				<xs:element ref="altitudCoord" />
			</xs:sequence>
		</xs:complexType>
	</xs:element>
	<xs:element name="sector">
		<xs:complexType>
			<xs:simpleContent>
				<xs:extension base="xs:positiveInteger">
				</xs:extension>
			</xs:simpleContent>
		</xs:complexType>
	</xs:element>
	<xs:element name="vencedor">
		<xs:complexType>
			<xs:sequence>
				<xs:element ref="nombreVencedor" />
				<xs:element ref="tiempo" />
			</xs:sequence>
		</xs:complexType>
	</xs:element>
	<xs:element name="nombreVencedor" type="xs:string" />
	<xs:element name="tiempo">
		<xs:complexType>
			<xs:simpleContent>
				<xs:extension base="xs:duration">
					<xs:attribute name="unidad" type="xs:string" />
				</xs:extension>
			</xs:simpleContent>
		</xs:complexType>
	</xs:element>
	<xs:element name="mundialClasificacion">
		<xs:complexType>
			<xs:sequence>
				<xs:element ref="piloto" />
				<xs:element ref="piloto" />
				<xs:element ref="piloto" />
			</xs:sequence>
		</xs:complexType>
	</xs:element>
	<xs:element name="piloto">
		<xs:complexType>
			<xs:simpleContent>
				<xs:extension base="xs:string">
					<xs:attribute name="posicion" type="xs:positiveInteger" use="required" />
					<xs:attribute name="equipo" type="xs:string" />
					<xs:attribute name="puntos" type="xs:positiveInteger" />
				</xs:extension>
			</xs:simpleContent>
		</xs:complexType>
	</xs:element>
</xs:schema>